title,url,has_fee
In Silico Clinical Trials : a way to improve clinical development?,http://ww2.amstat.org/meetings/jsm/2019/onlineprogram/AbstractDetails.cfm?abstractid=304548,FALSE
Single-Arm Two- and Three-stage Phase 2 Clinical Trials with Go/No-Go/Inconclusive Outcomes with Handling of Overrunning/Under-running,http://ww2.amstat.org/meetings/jsm/2019/onlineprogram/AbstractDetails.cfm?abstractid=304591,FALSE
Quantitative decision-making for single arm POC studies in early phase oncology,http://ww2.amstat.org/meetings/jsm/2019/onlineprogram/AbstractDetails.cfm?abstractid=304650,FALSE
Quantitative decision making in early clinical development – some statistical considerations,http://ww2.amstat.org/meetings/jsm/2019/onlineprogram/AbstractDetails.cfm?abstractid=304944,FALSE
Bayesian Interim Prediction of Probability of Clinical Trial Success,http://ww2.amstat.org/meetings/jsm/2019/onlineprogram/AbstractDetails.cfm?abstractid=305055,FALSE
Infusing Bayesian strategies for Pharmaceutical Manufacturing and Development,http://ww2.amstat.org/meetings/jsm/2019/onlineprogram/AbstractDetails.cfm?abstractid=305095,FALSE
High-dimensional association detection in large scale genomic data,http://ww2.amstat.org/meetings/jsm/2019/onlineprogram/AbstractDetails.cfm?abstractid=304361,FALSE
A Bayesian Semiparametric Approach to Wild-Type Distribution Estimation: Accounting for Contamination and Measurement Error (BayesACME),http://ww2.amstat.org/meetings/jsm/2019/onlineprogram/AbstractDetails.cfm?abstractid=304534,FALSE
From Mutation Signatures to Patient Subgroups: An application of Latent Dirichlet Allocation relating mutational signatures to patient characteristics ,http://ww2.amstat.org/meetings/jsm/2019/onlineprogram/AbstractDetails.cfm?abstractid=305193,FALSE
Bayesian Hierarchical Latent Variable Model for Time-varying Connectivity Analysis of Local Field Potentials,http://ww2.amstat.org/meetings/jsm/2019/onlineprogram/AbstractDetails.cfm?abstractid=305278,FALSE
Time to Event Prediction Based on Longitudinal Biomarkers using Bayesian Hierarchical Changepoint Mixture Models,http://ww2.amstat.org/meetings/jsm/2019/onlineprogram/AbstractDetails.cfm?abstractid=306619,FALSE
Statistical methods for correcting bias in attributable risk estimates,http://ww2.amstat.org/meetings/jsm/2019/onlineprogram/AbstractDetails.cfm?abstractid=307012,FALSE
Statistical Consideration in Interim Analysis Timing Optimization for Sample Size Re-estimation,http://ww2.amstat.org/meetings/jsm/2019/onlineprogram/AbstractDetails.cfm?abstractid=307392,FALSE
Using the MBISG 2.0 to Estimate Racial/Ethnic/Language Differences in Voluntary Health Plan Disenrollment,http://ww2.amstat.org/meetings/jsm/2019/onlineprogram/AbstractDetails.cfm?abstractid=306991,FALSE
Predicting 30-day Hospital Readmissions Using Deep Learning,http://ww2.amstat.org/meetings/jsm/2019/onlineprogram/AbstractDetails.cfm?abstractid=307279,FALSE
"Effects of Risk Adjustment for Groups of Variables:  Sicker, Poorer, Readmitted to the Hospital ",http://ww2.amstat.org/meetings/jsm/2019/onlineprogram/AbstractDetails.cfm?abstractid=306959,FALSE
Measuring Value-Added Quality in Medicare Advantage Contracts,http://ww2.amstat.org/meetings/jsm/2019/onlineprogram/AbstractDetails.cfm?abstractid=306768,FALSE
A comparison of provider profiling approaches with respect to low-volume providers,http://ww2.amstat.org/meetings/jsm/2019/onlineprogram/AbstractDetails.cfm?abstractid=306713,FALSE
Implementing Template Matching for Hospital Benchmarking in a Diverse Multi-Hospital System,http://ww2.amstat.org/meetings/jsm/2019/onlineprogram/AbstractDetails.cfm?abstractid=306527,FALSE
Hospital-Specific Template Matching for Benchmarking Performance in the Veterans Affairs Health System,http://ww2.amstat.org/meetings/jsm/2019/onlineprogram/AbstractDetails.cfm?abstractid=302902,FALSE
Random Rotations for High Dimensional Outlier Detection,http://ww2.amstat.org/meetings/jsm/2019/onlineprogram/AbstractDetails.cfm?abstractid=306685,FALSE
Convex Clustering Analysis for Histogram-Valued Data,http://ww2.amstat.org/meetings/jsm/2019/onlineprogram/AbstractDetails.cfm?abstractid=303055,FALSE
Sparse Canonical Correlation Analysis via Iterative Thresholding,http://ww2.amstat.org/meetings/jsm/2019/onlineprogram/AbstractDetails.cfm?abstractid=304109,FALSE
Global Point Matching Peak Alignment Algorithms Using Distance and Similarity Measures for Two-Dimensional Mass Spectrometry Data,http://ww2.amstat.org/meetings/jsm/2019/onlineprogram/AbstractDetails.cfm?abstractid=304692,FALSE
High-Dimensional Changepoint Detection via a Geometrically Inspired Mapping,http://ww2.amstat.org/meetings/jsm/2019/onlineprogram/AbstractDetails.cfm?abstractid=304253,FALSE
Graph-based change-point detection for data with repeated observations,http://ww2.amstat.org/meetings/jsm/2019/onlineprogram/AbstractDetails.cfm?abstractid=304637,FALSE
Inference for Change Points in High Dimensional Data via Self-Normalization,http://ww2.amstat.org/meetings/jsm/2019/onlineprogram/AbstractDetails.cfm?abstractid=304493,FALSE
Mixed Bayesian Additive Regression Trees for Random Effects,http://ww2.amstat.org/meetings/jsm/2019/onlineprogram/AbstractDetails.cfm?abstractid=305347,FALSE
Divide and Conquer algorithm of Bayesian Density Estimation,http://ww2.amstat.org/meetings/jsm/2019/onlineprogram/AbstractDetails.cfm?abstractid=302953,FALSE
A Bayesian Nonparametric Approach to Clustering Data at Multiple Resolutions,http://ww2.amstat.org/meetings/jsm/2019/onlineprogram/AbstractDetails.cfm?abstractid=305194,FALSE
Nonparametric Bayesian Functional Clustering for Breast Cancer Disparities,http://ww2.amstat.org/meetings/jsm/2019/onlineprogram/AbstractDetails.cfm?abstractid=305285,FALSE
Multivariate Functional Factor Models with Time-varying Clustering,http://ww2.amstat.org/meetings/jsm/2019/onlineprogram/AbstractDetails.cfm?abstractid=304794,FALSE
Bayesian subgroup analysis in regression using mixture models,http://ww2.amstat.org/meetings/jsm/2019/onlineprogram/AbstractDetails.cfm?abstractid=305141,FALSE
Mixtures of multivariate skew normal generalised hyperbolic factor analyzer models in a Bayesian framework,http://ww2.amstat.org/meetings/jsm/2019/onlineprogram/AbstractDetails.cfm?abstractid=306427,FALSE
Multiple treatment assessment via propensity scores in heavy censoring multivariate settings: Application to organ transplantation,http://ww2.amstat.org/meetings/jsm/2019/onlineprogram/AbstractDetails.cfm?abstractid=303076,FALSE
Hybrid Ridge-Lasso Regression,http://ww2.amstat.org/meetings/jsm/2019/onlineprogram/AbstractDetails.cfm?abstractid=305153,FALSE
A Data-Driven multiple testing Procedure,http://ww2.amstat.org/meetings/jsm/2019/onlineprogram/AbstractDetails.cfm?abstractid=307177,FALSE
Damped Anderson acceleration with restarts and monotonicity control for accelerating EM and EM-like algorithms,http://ww2.amstat.org/meetings/jsm/2019/onlineprogram/AbstractDetails.cfm?abstractid=303061,FALSE
Comparison of Bootstrapping Techniques in Multivariate Time Series,http://ww2.amstat.org/meetings/jsm/2019/onlineprogram/AbstractDetails.cfm?abstractid=304242,FALSE
Sampling distribution of pattern statistics in sparse Markov models,http://ww2.amstat.org/meetings/jsm/2019/onlineprogram/AbstractDetails.cfm?abstractid=304303,FALSE
 A Sequential Boothstrap/Resampling Method,http://ww2.amstat.org/meetings/jsm/2019/onlineprogram/AbstractDetails.cfm?abstractid=307360,FALSE
Comparison of Simple and Complex Predictive Models Applied to the National Surveys on Drug Use and Health,http://ww2.amstat.org/meetings/jsm/2019/onlineprogram/AbstractDetails.cfm?abstractid=304970,FALSE
Graph-based dependency criterion with applications in biology,http://ww2.amstat.org/meetings/jsm/2019/onlineprogram/AbstractDetails.cfm?abstractid=305282,FALSE
Bi-orthogonal Tensor Decomposition for Image Style Matching,http://ww2.amstat.org/meetings/jsm/2019/onlineprogram/AbstractDetails.cfm?abstractid=305303,FALSE
Learning Attribute Patterns in High-Dimensional Structured Latent Attribute Models,http://ww2.amstat.org/meetings/jsm/2019/onlineprogram/AbstractDetails.cfm?abstractid=306424,FALSE
Sparse Generalized Principal Component Analysis: Algorithms and Their Applications,http://ww2.amstat.org/meetings/jsm/2019/onlineprogram/AbstractDetails.cfm?abstractid=307015,FALSE
Tensor on Tensor Regression with Various Low-Rank Regression Parameters and Elliptically Contoured Distributed Errors,http://ww2.amstat.org/meetings/jsm/2019/onlineprogram/AbstractDetails.cfm?abstractid=307027,FALSE
Application of Personalized Growth Curve in Customer Life Time Value Estimation via Embedding,http://ww2.amstat.org/meetings/jsm/2019/onlineprogram/AbstractDetails.cfm?abstractid=305002,FALSE
New Insights into Modeling Exposure Measurements Below the Limit of Detection,http://ww2.amstat.org/meetings/jsm/2019/onlineprogram/AbstractDetails.cfm?abstractid=304877,FALSE
Berkson error with outcome model misspecification: Bias when using predicted values in place of observed covariates,http://ww2.amstat.org/meetings/jsm/2019/onlineprogram/AbstractDetails.cfm?abstractid=304813,FALSE
A semi-parametric approach to analyzing error-prone failure time outcomes and exposures,http://ww2.amstat.org/meetings/jsm/2019/onlineprogram/AbstractDetails.cfm?abstractid=305291,FALSE
Design and analysis of two-phase samples in discrete-time survival analysis with error-prone exposures,http://ww2.amstat.org/meetings/jsm/2019/onlineprogram/AbstractDetails.cfm?abstractid=306463,FALSE
Matched cohort studies and missing data in electronic health record data,http://ww2.amstat.org/meetings/jsm/2019/onlineprogram/AbstractDetails.cfm?abstractid=307164,FALSE
Relative Risk Estimation Using Multiple Imputation with Logistic Regression and Discretization,http://ww2.amstat.org/meetings/jsm/2019/onlineprogram/AbstractDetails.cfm?abstractid=305051,FALSE
A Doubly Robust Method to Handle Missing Multilevel Outcome Data with Application to a Cluster-Sampled Population-Based Study,http://ww2.amstat.org/meetings/jsm/2019/onlineprogram/AbstractDetails.cfm?abstractid=304553,FALSE
Detection and Classification of Changes in Protein-DNA Binding Activity With Applications in Diffuse ChIP-seq Data,http://ww2.amstat.org/meetings/jsm/2019/onlineprogram/AbstractDetails.cfm?abstractid=300660,FALSE
Cross-Platform Prediction of Regulatory Activities,http://ww2.amstat.org/meetings/jsm/2019/onlineprogram/AbstractDetails.cfm?abstractid=305137,FALSE
A change-point approach to identify hierarchical organization of topologically associated domains in Hi-C data,http://ww2.amstat.org/meetings/jsm/2019/onlineprogram/AbstractDetails.cfm?abstractid=305139,FALSE
SpectralTAD: defining hierarchy of Topologically Associated Domains using graph theoretical clustering,http://ww2.amstat.org/meetings/jsm/2019/onlineprogram/AbstractDetails.cfm?abstractid=306605,FALSE
Exploring Functional data analysis to Identify Differentially Methylated Regions in  Plants,http://ww2.amstat.org/meetings/jsm/2019/onlineprogram/AbstractDetails.cfm?abstractid=306689,FALSE
Identifying patterns of multi-genetic/epigenetic factors via non-parametric clustering,http://ww2.amstat.org/meetings/jsm/2019/onlineprogram/AbstractDetails.cfm?abstractid=305260,FALSE
Multiple-gene targeting and mismatch tolerance can confound analysis of genome-wide pooled CRISPR screens,http://ww2.amstat.org/meetings/jsm/2019/onlineprogram/AbstractDetails.cfm?abstractid=304860,FALSE
Comparing Time Series Graphical Lasso and Sparse VAR Algorithms,http://ww2.amstat.org/meetings/jsm/2019/onlineprogram/AbstractDetails.cfm?abstractid=307520,FALSE
Using Factor Analysis in variable selection and clustering of US mass shooting incidents,http://ww2.amstat.org/meetings/jsm/2019/onlineprogram/AbstractDetails.cfm?abstractid=307521,FALSE
Model selection for mixture of experts using group fused lasso,http://ww2.amstat.org/meetings/jsm/2019/onlineprogram/AbstractDetails.cfm?abstractid=307522,FALSE
Deep Learning and MARS: A Connection,http://ww2.amstat.org/meetings/jsm/2019/onlineprogram/AbstractDetails.cfm?abstractid=307523,FALSE
Distance and Kernel Measures of Conditional Independence,http://ww2.amstat.org/meetings/jsm/2019/onlineprogram/AbstractDetails.cfm?abstractid=307524,FALSE
Sparse Functional Principal Component Analysis in High Dimensions,http://ww2.amstat.org/meetings/jsm/2019/onlineprogram/AbstractDetails.cfm?abstractid=307525,FALSE
Activation Adaptation in Neural Networks,http://ww2.amstat.org/meetings/jsm/2019/onlineprogram/AbstractDetails.cfm?abstractid=307526,FALSE
Multiple Imputation versus Machine Learning: Predictive models to facilitate analyses of association between contemporaneous Medicaid/CHIP enrollment status and health measures,http://ww2.amstat.org/meetings/jsm/2019/onlineprogram/AbstractDetails.cfm?abstractid=307527,FALSE
A greedy-type variable selection procedure for selecting high-dimensional Cox models,http://ww2.amstat.org/meetings/jsm/2019/onlineprogram/AbstractDetails.cfm?abstractid=307528,FALSE
Cross-Validation for Correlated Data,http://ww2.amstat.org/meetings/jsm/2019/onlineprogram/AbstractDetails.cfm?abstractid=307529,FALSE
Inference for measurement error model under high dimensional settings,http://ww2.amstat.org/meetings/jsm/2019/onlineprogram/AbstractDetails.cfm?abstractid=307530,FALSE
Does t-SNE identify false structure? Implications of clusterability on t-SNE maps.,http://ww2.amstat.org/meetings/jsm/2019/onlineprogram/AbstractDetails.cfm?abstractid=307531,FALSE
Visual Diagnostics of a Model Explainer: Tools for the Assessment of LIME Explanations from Random Forests,http://ww2.amstat.org/meetings/jsm/2019/onlineprogram/AbstractDetails.cfm?abstractid=307532,FALSE
Quantile Regression Under Memory Constraint,http://ww2.amstat.org/meetings/jsm/2019/onlineprogram/AbstractDetails.cfm?abstractid=307533,FALSE
Equilibrium Metrics for Dynamic Supply-Demand Networks,http://ww2.amstat.org/meetings/jsm/2019/onlineprogram/AbstractDetails.cfm?abstractid=307534,FALSE
Topological survival analysis for the comparison of random fields,http://ww2.amstat.org/meetings/jsm/2019/onlineprogram/AbstractDetails.cfm?abstractid=307722,FALSE
Curve registration to identify circadian rhythm chronotypes in accelerometer data,http://ww2.amstat.org/meetings/jsm/2019/onlineprogram/AbstractDetails.cfm?abstractid=307535,FALSE
Mallows Model Averaging of Support Vector Machine Classfiers and Regressors,http://ww2.amstat.org/meetings/jsm/2019/onlineprogram/AbstractDetails.cfm?abstractid=307536,FALSE
To select or not to select? Variable selection in the estimation of drug use prevalence in Denmark ,http://ww2.amstat.org/meetings/jsm/2019/onlineprogram/AbstractDetails.cfm?abstractid=307537,FALSE
Efficient Randomized Algorithms for Continuous Space Reinforcement Learning,http://ww2.amstat.org/meetings/jsm/2019/onlineprogram/AbstractDetails.cfm?abstractid=307538,FALSE
Comparing Performance of Gene Set Test Methods Using Biologically Relevant Simulated Data,http://ww2.amstat.org/meetings/jsm/2019/onlineprogram/AbstractDetails.cfm?abstractid=307539,FALSE
"A Bottom-up Approach to Testing Hypotheses That Have a Branching Tree Dependence Structure, with False Discovery Rate Control",http://ww2.amstat.org/meetings/jsm/2019/onlineprogram/AbstractDetails.cfm?abstractid=307540,FALSE
A Generalized Multi-Response Permutation Procedure to Evaluate Associations of Multivariate Data with Quantitative and Censored-Event Time Variables,http://ww2.amstat.org/meetings/jsm/2019/onlineprogram/AbstractDetails.cfm?abstractid=307541,FALSE
The Robust Kernel Association Test,http://ww2.amstat.org/meetings/jsm/2019/onlineprogram/AbstractDetails.cfm?abstractid=307542,FALSE
Regularized Regression by Graph Propagation for Genomic Data Analysis,http://ww2.amstat.org/meetings/jsm/2019/onlineprogram/AbstractDetails.cfm?abstractid=307543,FALSE
Assessing exposure effects on gene expression using inverse probability weighting and the parametric g-formula,http://ww2.amstat.org/meetings/jsm/2019/onlineprogram/AbstractDetails.cfm?abstractid=307544,FALSE
Methods for handling correlated covariates in integrative genomics analysis,http://ww2.amstat.org/meetings/jsm/2019/onlineprogram/AbstractDetails.cfm?abstractid=307545,FALSE
OncoCast: an improved interface for survival analysis using genomic data,http://ww2.amstat.org/meetings/jsm/2019/onlineprogram/AbstractDetails.cfm?abstractid=307546,FALSE
Identifying  Appropriate  Probabilistic  Models  for  Sparse  Discrete  Omics Data,http://ww2.amstat.org/meetings/jsm/2019/onlineprogram/AbstractDetails.cfm?abstractid=307547,FALSE
Bayesian inference for reconstructing intra-tumor phylogeny,http://ww2.amstat.org/meetings/jsm/2019/onlineprogram/AbstractDetails.cfm?abstractid=307548,FALSE
pasLINCS: Pathway activity signatures from LINCS L1000 consensus gene signatures,http://ww2.amstat.org/meetings/jsm/2019/onlineprogram/AbstractDetails.cfm?abstractid=307549,FALSE
Efficient estimation of ancestry proportions using genotype frequencies,http://ww2.amstat.org/meetings/jsm/2019/onlineprogram/AbstractDetails.cfm?abstractid=307550,FALSE
Likelihood Based Mixture Modeling of Genetic Regulatory Networks,http://ww2.amstat.org/meetings/jsm/2019/onlineprogram/AbstractDetails.cfm?abstractid=307551,FALSE
Selection of genesets from a Cox model with higher-order interaction of covariate genes,http://ww2.amstat.org/meetings/jsm/2019/onlineprogram/AbstractDetails.cfm?abstractid=307552,FALSE
A Powerful and Versatile Colocalization Test,http://ww2.amstat.org/meetings/jsm/2019/onlineprogram/AbstractDetails.cfm?abstractid=307553,FALSE
The Rabl configuration limits topological entanglement of chromosomes in budding yeast,http://ww2.amstat.org/meetings/jsm/2019/onlineprogram/AbstractDetails.cfm?abstractid=307554,FALSE
OASW clustering ,http://ww2.amstat.org/meetings/jsm/2019/onlineprogram/AbstractDetails.cfm?abstractid=307555,FALSE
Comparing Methods for Familial Relationship Inference in Populations with Complex Demographic History,http://ww2.amstat.org/meetings/jsm/2019/onlineprogram/AbstractDetails.cfm?abstractid=307557,FALSE
On Simulating Ultra High-Dimensional Multivariate Data,http://ww2.amstat.org/meetings/jsm/2019/onlineprogram/AbstractDetails.cfm?abstractid=307558,FALSE
Control Confounding by Familial Relatedness in Genome-Wide Association Studies,http://ww2.amstat.org/meetings/jsm/2019/onlineprogram/AbstractDetails.cfm?abstractid=307692,FALSE
Prevalence of Sexual Orientation and Gender Identity Behaviors: An Approach for State-level and National Estimation Derived from the Behavioral Risk Factor Surveillance System,http://ww2.amstat.org/meetings/jsm/2019/onlineprogram/AbstractDetails.cfm?abstractid=305025,FALSE
Joint Estimation and Regularized Aggregation of Brain Network in fMRI Data,http://ww2.amstat.org/meetings/jsm/2019/onlineprogram/AbstractDetails.cfm?abstractid=306755,FALSE
Differentially private goodness-of-fit test for continuous random variable.,http://ww2.amstat.org/meetings/jsm/2019/onlineprogram/AbstractDetails.cfm?abstractid=306647,FALSE
Estimation of semi-parametric Hidden Markov Model and Multiple Testing under Dependenct strcuture,http://ww2.amstat.org/meetings/jsm/2019/onlineprogram/AbstractDetails.cfm?abstractid=301722,FALSE
Finite Mixture Regression Models for Stratified Sample,http://ww2.amstat.org/meetings/jsm/2019/onlineprogram/AbstractDetails.cfm?abstractid=307982,FALSE
Relative Accuracy of Multivariate Bootstrap Procedures,http://ww2.amstat.org/meetings/jsm/2019/onlineprogram/AbstractDetails.cfm?abstractid=306590,FALSE
Multiple hypothesis testing with discrete data: Minimally discrete p-values,http://ww2.amstat.org/meetings/jsm/2019/onlineprogram/AbstractDetails.cfm?abstractid=302871,FALSE
A Bayesian Approach to Factor Screening for Multivariate Responses,http://ww2.amstat.org/meetings/jsm/2019/onlineprogram/AbstractDetails.cfm?abstractid=304216,FALSE
Sufficient Dimension Reduction via Fourier Transformation,http://ww2.amstat.org/meetings/jsm/2019/onlineprogram/AbstractDetails.cfm?abstractid=304182,FALSE
Sparse SIR: Optimal Rates and Adaptive Estimation,http://ww2.amstat.org/meetings/jsm/2019/onlineprogram/AbstractDetails.cfm?abstractid=303090,FALSE
Unobserved Covariate Imbalance  of Covariate-Adaptive Randomized Experiments,http://ww2.amstat.org/meetings/jsm/2019/onlineprogram/AbstractDetails.cfm?abstractid=305240,FALSE
A rank-based regression tree for subgroup identification,http://ww2.amstat.org/meetings/jsm/2019/onlineprogram/AbstractDetails.cfm?abstractid=305235,FALSE
Detecting Statistical Interactions via Additive Neural Network ,http://ww2.amstat.org/meetings/jsm/2019/onlineprogram/AbstractDetails.cfm?abstractid=305220,FALSE
Generating Knockoffs without Knowing the Distributions of the Covariates,http://ww2.amstat.org/meetings/jsm/2019/onlineprogram/AbstractDetails.cfm?abstractid=308011,FALSE
A Nonparametric Comparison of Quantiles Test Between Two Populations,http://ww2.amstat.org/meetings/jsm/2019/onlineprogram/AbstractDetails.cfm?abstractid=304935,FALSE
Strong Consistency of the Non-parametric Maximum Likelihood Estimator of Correlated Normal Random Variables,http://ww2.amstat.org/meetings/jsm/2019/onlineprogram/AbstractDetails.cfm?abstractid=304336,FALSE
Improvement of the accuracy in testing the effect in the Cox proportional hazards model using higher order approximations.,http://ww2.amstat.org/meetings/jsm/2019/onlineprogram/AbstractDetails.cfm?abstractid=304355,FALSE
Exact Meta-Analysis Using a Permutation-Based Approach,http://ww2.amstat.org/meetings/jsm/2019/onlineprogram/AbstractDetails.cfm?abstractid=304452,FALSE
A Robust Statistical Method to Estimate the Intervention Effect with Longitudinal Data,http://ww2.amstat.org/meetings/jsm/2019/onlineprogram/AbstractDetails.cfm?abstractid=304477,FALSE
Empirical likelihood ratio tests with power one,http://ww2.amstat.org/meetings/jsm/2019/onlineprogram/AbstractDetails.cfm?abstractid=304492,FALSE
Nonparametric estimation of blood alcohol concentration from transdermal alcohol measurements using alcohol biosensor devices.,http://ww2.amstat.org/meetings/jsm/2019/onlineprogram/AbstractDetails.cfm?abstractid=304598,FALSE
Monotonic Nonparametric Dose Response Model,http://ww2.amstat.org/meetings/jsm/2019/onlineprogram/AbstractDetails.cfm?abstractid=304744,FALSE
A Data-Adaptive Targeted Learning Approach of Evaluating Viscoelastic Assay Driven Trauma Treatment Protocols,http://ww2.amstat.org/meetings/jsm/2019/onlineprogram/AbstractDetails.cfm?abstractid=304827,FALSE
Non Linear Functional Data Imputation,http://ww2.amstat.org/meetings/jsm/2019/onlineprogram/AbstractDetails.cfm?abstractid=302914,FALSE
Extension of integral curves estimation to a time-dependent tensor field model,http://ww2.amstat.org/meetings/jsm/2019/onlineprogram/AbstractDetails.cfm?abstractid=304848,FALSE
Nonparametric estimation of multivariate mixtures,http://ww2.amstat.org/meetings/jsm/2019/onlineprogram/AbstractDetails.cfm?abstractid=304972,FALSE
On the rate of convergence of a neural network regression estimate learned by gradient descent,http://ww2.amstat.org/meetings/jsm/2019/onlineprogram/AbstractDetails.cfm?abstractid=305090,FALSE
Model-Based Quantile Regression: Analyzing Excess-Zero Response,http://ww2.amstat.org/meetings/jsm/2019/onlineprogram/AbstractDetails.cfm?abstractid=305159,FALSE
Sparse function-on-scalar regression using a group bridge approach with application to iEEG data,http://ww2.amstat.org/meetings/jsm/2019/onlineprogram/AbstractDetails.cfm?abstractid=305318,FALSE
Semiparametric Approach to Optimal Sensor Location Design for a Photovoltaic Power Plant,http://ww2.amstat.org/meetings/jsm/2019/onlineprogram/AbstractDetails.cfm?abstractid=306588,FALSE
Application of a Nonparametric Test for Comparing Transition Probabilities in Multi-State Models,http://ww2.amstat.org/meetings/jsm/2019/onlineprogram/AbstractDetails.cfm?abstractid=306726,FALSE
Simultaneous bootstrap confidence intervals for scale difference using deviances,http://ww2.amstat.org/meetings/jsm/2019/onlineprogram/AbstractDetails.cfm?abstractid=306856,FALSE
Nonparametric Density Estimation under Adversarial Losses,http://ww2.amstat.org/meetings/jsm/2019/onlineprogram/AbstractDetails.cfm?abstractid=306913,FALSE
Soft Functional Alignment of Functional Data Using Landmark Information,http://ww2.amstat.org/meetings/jsm/2019/onlineprogram/AbstractDetails.cfm?abstractid=306931,FALSE
Modeling kidney function decline via functional principal components analysis (FPCA),http://ww2.amstat.org/meetings/jsm/2019/onlineprogram/AbstractDetails.cfm?abstractid=304828,FALSE
Evaluating Sensitivity of Beryllium Flyer Plate Simulations to Strength Parameterization,http://ww2.amstat.org/meetings/jsm/2019/onlineprogram/AbstractDetails.cfm?abstractid=307991,FALSE
Data Visualization for Oil and Gas Pipeline Anomalies and Repairs using R Shiny,http://ww2.amstat.org/meetings/jsm/2019/onlineprogram/AbstractDetails.cfm?abstractid=302875,FALSE
The Fundamental Diagram and the Statistics of a Passageway,http://ww2.amstat.org/meetings/jsm/2019/onlineprogram/AbstractDetails.cfm?abstractid=302978,FALSE
Comparing Variance-Based versus Count Methods for Determining Variable Activity in Bayesian Additive Regression Trees,http://ww2.amstat.org/meetings/jsm/2019/onlineprogram/AbstractDetails.cfm?abstractid=304406,FALSE
Examining Driver Risk Factors in Road Departure Accidents Using Longitudinal Data Collected for a Fixed Cohort of Drivers,http://ww2.amstat.org/meetings/jsm/2019/onlineprogram/AbstractDetails.cfm?abstractid=304684,FALSE
An Expectation-Maximization (EM) Algorithm for Orbit Linkage and Determination,http://ww2.amstat.org/meetings/jsm/2019/onlineprogram/AbstractDetails.cfm?abstractid=304706,FALSE
Quantum Channel Probing with Indefinite Causal Ordering,http://ww2.amstat.org/meetings/jsm/2019/onlineprogram/AbstractDetails.cfm?abstractid=305243,FALSE
