title,url,has_fee
Two Chapters in the Development of Human Population Sampling (1895/1934),http://ww2.amstat.org/meetings/jsm/2019/onlineprogram/AbstractDetails.cfm?abstractid=304998,FALSE
Brewing Up Statistics: A look at Gosset’s contributions,http://ww2.amstat.org/meetings/jsm/2019/onlineprogram/AbstractDetails.cfm?abstractid=306985,FALSE
Using Primary Historical Sources to Teach Statistics,http://ww2.amstat.org/meetings/jsm/2019/onlineprogram/AbstractDetails.cfm?abstractid=304181,FALSE
A One-Credit History of Statistics Course using “The Lady Tasting Tea” by David Salsburg with Supplementary Readings,http://ww2.amstat.org/meetings/jsm/2019/onlineprogram/AbstractDetails.cfm?abstractid=304305,FALSE
Implementing spatial statistical methods for massive data,http://ww2.amstat.org/meetings/jsm/2019/onlineprogram/AbstractDetails.cfm?abstractid=306987,FALSE
Scalable gapfilling in spatio-temporal remote sensing data,http://ww2.amstat.org/meetings/jsm/2019/onlineprogram/AbstractDetails.cfm?abstractid=303082,FALSE
Detecting changes in precipitation extremes at their native scales over the contiguous United States,http://ww2.amstat.org/meetings/jsm/2019/onlineprogram/AbstractDetails.cfm?abstractid=304128,FALSE
Nonstationary spatial data: think globally act locally,http://ww2.amstat.org/meetings/jsm/2019/onlineprogram/AbstractDetails.cfm?abstractid=307001,FALSE
GPU Accelerated Deep Learning for Climate and Weather ,http://ww2.amstat.org/meetings/jsm/2019/onlineprogram/AbstractDetails.cfm?abstractid=302958,FALSE
Applying the EM Algorithm to Multivariate Signal Extraction,http://ww2.amstat.org/meetings/jsm/2019/onlineprogram/AbstractDetails.cfm?abstractid=304529,FALSE
Dual Coupled Kalman Filters for Simultaneously Updating Estimated Time-Varying States and Parameters of VARMA Models Using Data with Periodically or Non-Periodically Missing Values,http://ww2.amstat.org/meetings/jsm/2019/onlineprogram/AbstractDetails.cfm?abstractid=304642,FALSE
Gaussian copula vector autoregressive modeling,http://ww2.amstat.org/meetings/jsm/2019/onlineprogram/AbstractDetails.cfm?abstractid=306761,FALSE
Constrained Estimation in Co-integrated VAR Models,http://ww2.amstat.org/meetings/jsm/2019/onlineprogram/AbstractDetails.cfm?abstractid=306921,FALSE
A class of multivariate filters for trend extraction and statistical analysis of multiple related time series,http://ww2.amstat.org/meetings/jsm/2019/onlineprogram/AbstractDetails.cfm?abstractid=307175,FALSE
Adapting Data Collection Activities Using Survey Fielding Metrics,http://ww2.amstat.org/meetings/jsm/2019/onlineprogram/AbstractDetails.cfm?abstractid=307159,FALSE
Responsive & Adaptive Survey Design: Use of Bias Propensity During Data Collection to Reduce Nonresponse Bias,http://ww2.amstat.org/meetings/jsm/2019/onlineprogram/AbstractDetails.cfm?abstractid=305271,FALSE
Dynamic Interventions for Outcome Improvement: Minimizing Cost for a Fixed RMSE,http://ww2.amstat.org/meetings/jsm/2019/onlineprogram/AbstractDetails.cfm?abstractid=305083,FALSE
Using Cost-Calibration Trade-offs in Establishment Surveys to Allocate Cases by Mode,http://ww2.amstat.org/meetings/jsm/2019/onlineprogram/AbstractDetails.cfm?abstractid=306459,FALSE
Use of Adaptive and Responsive Design Concepts and Methods in the Integration of Multiple Data Sources,http://ww2.amstat.org/meetings/jsm/2019/onlineprogram/AbstractDetails.cfm?abstractid=304542,FALSE
The Effect of Bariatric Surgery on Health Care Costs: A Synthetic Control Approach Using Bayesian Structural Time Series,http://ww2.amstat.org/meetings/jsm/2019/onlineprogram/AbstractDetails.cfm?abstractid=302869,FALSE
A Latent Class Based Joint Model for Recurrence and Termination with Application to Heart Transplants,http://ww2.amstat.org/meetings/jsm/2019/onlineprogram/AbstractDetails.cfm?abstractid=302878,FALSE
Posterior Predictive Treatment Assignment Methods for Causal Inference in the Context of Time-Varying Treatments,http://ww2.amstat.org/meetings/jsm/2019/onlineprogram/AbstractDetails.cfm?abstractid=302942,FALSE
 A Bayesian Difference-in-Differences Framework for Measuring the Impact of Primary Care Redesign on Diabetes Outcomes,http://ww2.amstat.org/meetings/jsm/2019/onlineprogram/AbstractDetails.cfm?abstractid=304158,FALSE
A Bayesian Hierarchical Causal Effect Model Accounting for Incomplete Noncompliance Data in Meta-analysis,http://ww2.amstat.org/meetings/jsm/2019/onlineprogram/AbstractDetails.cfm?abstractid=304331,FALSE
Polling bias from undecided voters in recent US Presidential elections,http://ww2.amstat.org/meetings/jsm/2019/onlineprogram/AbstractDetails.cfm?abstractid=301802,FALSE
"Complementing the power of deep learning with statistical model fusion: Probabilistic forecasting of influenza in Dallas County, Texas, USA",http://ww2.amstat.org/meetings/jsm/2019/onlineprogram/AbstractDetails.cfm?abstractid=301804,FALSE
Predicting interviewer effects using paradata,http://ww2.amstat.org/meetings/jsm/2019/onlineprogram/AbstractDetails.cfm?abstractid=303057,FALSE
Reinforced designs for observational studies of treatment effects: Multiple instruments plus control groups as evidence factors,http://ww2.amstat.org/meetings/jsm/2019/onlineprogram/AbstractDetails.cfm?abstractid=304256,FALSE
Accounting for survey design in Bayesian disaggregation of survey-based areal estimates of proportions,http://ww2.amstat.org/meetings/jsm/2019/onlineprogram/AbstractDetails.cfm?abstractid=304709,FALSE
Catalyzing Change: Creating the Reality that Statistical Reasoning Skills are Vital for all Students,http://ww2.amstat.org/meetings/jsm/2019/onlineprogram/AbstractDetails.cfm?abstractid=302991,FALSE
A Partial Simulation Study of Phantom Effects in Multilevel Analysis of School Effects: The Case of School Socioeconomic Composition,http://ww2.amstat.org/meetings/jsm/2019/onlineprogram/AbstractDetails.cfm?abstractid=301845,FALSE
Measuring Impact of Tax Law Changes on CPS ASEC Tax Model,http://ww2.amstat.org/meetings/jsm/2019/onlineprogram/AbstractDetails.cfm?abstractid=304444,FALSE
"Break Detection Methods Applied for Int'l GDP p.c. Time-Series Data, Together with Economics & Block-chain Techs",http://ww2.amstat.org/meetings/jsm/2019/onlineprogram/AbstractDetails.cfm?abstractid=304498,FALSE
Factors Contributing to Successful Employment Outcomes for Individuals who are Hard-of-Hearing,http://ww2.amstat.org/meetings/jsm/2019/onlineprogram/AbstractDetails.cfm?abstractid=304628,FALSE
Implementing empirical results of panel models with lagged dependent variables and random intercepts into microsimulation,http://ww2.amstat.org/meetings/jsm/2019/onlineprogram/AbstractDetails.cfm?abstractid=304679,FALSE
A Spatial Microsimulation Model of Labor Market Integration in Germany,http://ww2.amstat.org/meetings/jsm/2019/onlineprogram/AbstractDetails.cfm?abstractid=304681,FALSE
Patterns of Effects and Sensitivity Analysis for Differences-in-Differences,http://ww2.amstat.org/meetings/jsm/2019/onlineprogram/AbstractDetails.cfm?abstractid=304717,FALSE
Using statistical and machine learning methods to analyze response time data from computer-based educational assessments,http://ww2.amstat.org/meetings/jsm/2019/onlineprogram/AbstractDetails.cfm?abstractid=304839,FALSE
Finding the Strength in a Weak Instrument in a Study of Cognitive Outcomes Produced by Catholic High Schools,http://ww2.amstat.org/meetings/jsm/2019/onlineprogram/AbstractDetails.cfm?abstractid=304946,FALSE
Predicting Poverty Using Remote Sensing Vegetation Indices,http://ww2.amstat.org/meetings/jsm/2019/onlineprogram/AbstractDetails.cfm?abstractid=305069,FALSE
Gender gap in the perception of safety in subways,http://ww2.amstat.org/meetings/jsm/2019/onlineprogram/AbstractDetails.cfm?abstractid=306686,FALSE
Presenting results of statistical tests in graphical format ,http://ww2.amstat.org/meetings/jsm/2019/onlineprogram/AbstractDetails.cfm?abstractid=306688,FALSE
A panel analytic approach to modeling sleep-related outcomes among older adults in China,http://ww2.amstat.org/meetings/jsm/2019/onlineprogram/AbstractDetails.cfm?abstractid=306799,FALSE
Framing of Culture War Issues in Congressional Campaign Websites,http://ww2.amstat.org/meetings/jsm/2019/onlineprogram/AbstractDetails.cfm?abstractid=306889,FALSE
Data-driven community based programming:  A Statistical Analysis of Heart Disease Prevention Initiatives in Oklahoma City-County,http://ww2.amstat.org/meetings/jsm/2019/onlineprogram/AbstractDetails.cfm?abstractid=306997,FALSE
Confidence Intervals for Marginal Effects and Predictive Margins in Logit Models,http://ww2.amstat.org/meetings/jsm/2019/onlineprogram/AbstractDetails.cfm?abstractid=307189,FALSE
Making data-driven decisions about serving homeless populations using machine learning tools,http://ww2.amstat.org/meetings/jsm/2019/onlineprogram/AbstractDetails.cfm?abstractid=307214,FALSE
Scoring fingerprint images to explain human performance on identification tasks,http://ww2.amstat.org/meetings/jsm/2019/onlineprogram/AbstractDetails.cfm?abstractid=307233,FALSE
A statistical measure of gerrymandering and compactness of district maps,http://ww2.amstat.org/meetings/jsm/2019/onlineprogram/AbstractDetails.cfm?abstractid=307249,FALSE
Getting a Clear Picture of Students’ Writing Performance,http://ww2.amstat.org/meetings/jsm/2019/onlineprogram/AbstractDetails.cfm?abstractid=307255,FALSE
Impact of approaches for clinical and radiological monitoring on predicting of short-term and long-term disability outcomes in multiple sclerosis,http://ww2.amstat.org/meetings/jsm/2019/onlineprogram/AbstractDetails.cfm?abstractid=304254,FALSE
Assessment of Biomarker Strategies in Lung Cancer Management via Net Reclassification Indices,http://ww2.amstat.org/meetings/jsm/2019/onlineprogram/AbstractDetails.cfm?abstractid=306649,FALSE
New Results on the Weighted Generalized Score for Comparing Two Correlated Means,http://ww2.amstat.org/meetings/jsm/2019/onlineprogram/AbstractDetails.cfm?abstractid=307246,FALSE
Developing year-long mobile health interventions to improve mental health outcomes among medical interns: experimental design and statistical methods ,http://ww2.amstat.org/meetings/jsm/2019/onlineprogram/AbstractDetails.cfm?abstractid=304797,FALSE
Lowering Sample Size Requirements for Mixture Modeling in Mental Health Research,http://ww2.amstat.org/meetings/jsm/2019/onlineprogram/AbstractDetails.cfm?abstractid=305106,FALSE
Psychotherapy Outcomes for Adults with Autism Spectrum Disorder in a University Counseling Setting,http://ww2.amstat.org/meetings/jsm/2019/onlineprogram/AbstractDetails.cfm?abstractid=306631,FALSE
Sample size calculations in single-case designs,http://ww2.amstat.org/meetings/jsm/2019/onlineprogram/AbstractDetails.cfm?abstractid=307323,FALSE
Importance of data quality for national HIV prevention program monitoring and evaluation,http://ww2.amstat.org/meetings/jsm/2019/onlineprogram/AbstractDetails.cfm?abstractid=302992,FALSE
Coffee and Cardiovascular Disease Prevention,http://ww2.amstat.org/meetings/jsm/2019/onlineprogram/AbstractDetails.cfm?abstractid=304864,FALSE
"Tolerance Intervals for Autoregressive Models, with an Application to Hospital Waiting Lists",http://ww2.amstat.org/meetings/jsm/2019/onlineprogram/AbstractDetails.cfm?abstractid=304863,FALSE
Temporal Association of Prostate and Colon Cancer with World Trade Center Rescue/Recovery Work: A 14 Year Cohort Study ,http://ww2.amstat.org/meetings/jsm/2019/onlineprogram/AbstractDetails.cfm?abstractid=306945,FALSE
"Age-period-cohort analysis of lead body burden in the United States, 1976-2016",http://ww2.amstat.org/meetings/jsm/2019/onlineprogram/AbstractDetails.cfm?abstractid=306476,FALSE
Optimality in group testing estimation with misclassification,http://ww2.amstat.org/meetings/jsm/2019/onlineprogram/AbstractDetails.cfm?abstractid=307404,FALSE
Joint valid moments Bayesian marginal logistic regression model with time dependent covariates,http://ww2.amstat.org/meetings/jsm/2019/onlineprogram/AbstractDetails.cfm?abstractid=306842,FALSE
A Bayesian Zero Inflated Binomial Model for Repeated Measures Count Data,http://ww2.amstat.org/meetings/jsm/2019/onlineprogram/AbstractDetails.cfm?abstractid=307386,FALSE
Predicting the absolute risk of undetected uterine cancer in a matched case-control study,http://ww2.amstat.org/meetings/jsm/2019/onlineprogram/AbstractDetails.cfm?abstractid=306981,FALSE
Experiences with Incorporating R into a Second-Level Biostatistics Course for MPH students,http://ww2.amstat.org/meetings/jsm/2019/onlineprogram/AbstractDetails.cfm?abstractid=306766,FALSE
Rank-based approach for estimating correlations in mixed ordinal data,http://ww2.amstat.org/meetings/jsm/2019/onlineprogram/AbstractDetails.cfm?abstractid=305308,FALSE
Pre-Conceptions of Statistical Inference in Biostatistics,http://ww2.amstat.org/meetings/jsm/2019/onlineprogram/AbstractDetails.cfm?abstractid=304142,FALSE
Mediation Analysis for Longitudinal Data with Applications to Clinical Trial Data,http://ww2.amstat.org/meetings/jsm/2019/onlineprogram/AbstractDetails.cfm?abstractid=305314,FALSE
Adjusting Response Adaptive Allocation for Subject Dropout,http://ww2.amstat.org/meetings/jsm/2019/onlineprogram/AbstractDetails.cfm?abstractid=306572,FALSE
The use of a new classifier to maximize the classification performance,http://ww2.amstat.org/meetings/jsm/2019/onlineprogram/AbstractDetails.cfm?abstractid=306669,FALSE
Reproducibility of Living Data - Validation of Published Research Using the Parkinson’s Progression Marker Initiative Living Database,http://ww2.amstat.org/meetings/jsm/2019/onlineprogram/AbstractDetails.cfm?abstractid=306698,FALSE
Blinding in Open label study with Adaptive Design,http://ww2.amstat.org/meetings/jsm/2019/onlineprogram/AbstractDetails.cfm?abstractid=306723,FALSE
Systematic Prediction of the Performance of Due-Agent Dose Escalation Methods,http://ww2.amstat.org/meetings/jsm/2019/onlineprogram/AbstractDetails.cfm?abstractid=306806,FALSE
Another estimation method besides MMRM for treatment effects in diabetes clinical trials,http://ww2.amstat.org/meetings/jsm/2019/onlineprogram/AbstractDetails.cfm?abstractid=306879,FALSE
Criteria for Choosing a Futility Method for Clinical Studies,http://ww2.amstat.org/meetings/jsm/2019/onlineprogram/AbstractDetails.cfm?abstractid=306952,FALSE
Random Forests for Exploring Factors Driving Opioid Prescribing in National Outpatient Health Care Data using Complex Survey Design,http://ww2.amstat.org/meetings/jsm/2019/onlineprogram/AbstractDetails.cfm?abstractid=306968,FALSE
An Adaptive Phase II Dose Finding Study Using Sample Size Re-estimation Design,http://ww2.amstat.org/meetings/jsm/2019/onlineprogram/AbstractDetails.cfm?abstractid=307034,FALSE
Optimal Treatment Selection in Immuno-oncology Trials based on RMST,http://ww2.amstat.org/meetings/jsm/2019/onlineprogram/AbstractDetails.cfm?abstractid=307047,FALSE
Quantifying the number of events borrowed from external data in hybrid control arms,http://ww2.amstat.org/meetings/jsm/2019/onlineprogram/AbstractDetails.cfm?abstractid=307068,FALSE
Characterizing Irreproducibility in Drug Sensitivity Data from a Large Pharmacogenomic Study,http://ww2.amstat.org/meetings/jsm/2019/onlineprogram/AbstractDetails.cfm?abstractid=307117,FALSE
Closest Similar Subset Imputation,http://ww2.amstat.org/meetings/jsm/2019/onlineprogram/AbstractDetails.cfm?abstractid=307152,FALSE
Planning and analyzing clinical trials with competing risks: Recommendations for choosing appropriate statistical methodology,http://ww2.amstat.org/meetings/jsm/2019/onlineprogram/AbstractDetails.cfm?abstractid=307281,FALSE
Estimating and using the attained power distribution to ensure we get the trial power we expect ,http://ww2.amstat.org/meetings/jsm/2019/onlineprogram/AbstractDetails.cfm?abstractid=304799,FALSE
Bayesian Semiparametric Joint modeling of longitudinal predictors and a binary outcome,http://ww2.amstat.org/meetings/jsm/2019/onlineprogram/AbstractDetails.cfm?abstractid=303025,FALSE
Clustering of Multivariate Data with Varying Dimensions,http://ww2.amstat.org/meetings/jsm/2019/onlineprogram/AbstractDetails.cfm?abstractid=306499,FALSE
Sieve Maximum Likelihood Method for Interval-Censored Data with Missing Covariates Under Proportional Hazards Model,http://ww2.amstat.org/meetings/jsm/2019/onlineprogram/AbstractDetails.cfm?abstractid=305370,FALSE
Estimating the relative risk for  response-biased samples: Calibration and conditional likelihood,http://ww2.amstat.org/meetings/jsm/2019/onlineprogram/AbstractDetails.cfm?abstractid=307391,FALSE
Bayesian Spatially Clustered Coefficient Regression,http://ww2.amstat.org/meetings/jsm/2019/onlineprogram/AbstractDetails.cfm?abstractid=305032,FALSE
Spatial Cox Model with Applications on Multiple Sclerosis Patients ,http://ww2.amstat.org/meetings/jsm/2019/onlineprogram/AbstractDetails.cfm?abstractid=304134,FALSE
Variational Inference for Latent Space Models for Dynamic Networks,http://ww2.amstat.org/meetings/jsm/2019/onlineprogram/AbstractDetails.cfm?abstractid=304618,FALSE
A new flexible prior being local and nonlocal for Bayesian Variable Selection,http://ww2.amstat.org/meetings/jsm/2019/onlineprogram/AbstractDetails.cfm?abstractid=304740,FALSE
A Bayesian Two-Part Quantile Regression Model for Count Data with Excess Zeros,http://ww2.amstat.org/meetings/jsm/2019/onlineprogram/AbstractDetails.cfm?abstractid=304530,FALSE
Nonparametric Density Estimation and Regression Using Coarse Count Data,http://ww2.amstat.org/meetings/jsm/2019/onlineprogram/AbstractDetails.cfm?abstractid=305087,FALSE
Revisiting the proton-radius problem using constrained Gaussian processes,http://ww2.amstat.org/meetings/jsm/2019/onlineprogram/AbstractDetails.cfm?abstractid=305145,FALSE
An investigation into how model uncertainty is reflected through the posterior variance for partial regression coefficients ,http://ww2.amstat.org/meetings/jsm/2019/onlineprogram/AbstractDetails.cfm?abstractid=305200,FALSE
An Objective Bayesian Multiple Testing for Correlated Binomial Proportions,http://ww2.amstat.org/meetings/jsm/2019/onlineprogram/AbstractDetails.cfm?abstractid=305222,FALSE
Bayesian model selection using mass-nonlocal prior,http://ww2.amstat.org/meetings/jsm/2019/onlineprogram/AbstractDetails.cfm?abstractid=305367,FALSE
The Use of Experimental Design and Bayesian Logistic Models in Defense Analysis: a Case Study ,http://ww2.amstat.org/meetings/jsm/2019/onlineprogram/AbstractDetails.cfm?abstractid=306475,FALSE
Bayesian model selection and averaging in the presence of latent heteroscedasticity in linear models,http://ww2.amstat.org/meetings/jsm/2019/onlineprogram/AbstractDetails.cfm?abstractid=304817,FALSE
Predictive Density Estimation of Multivariate Skew-normal Distribution,http://ww2.amstat.org/meetings/jsm/2019/onlineprogram/AbstractDetails.cfm?abstractid=306436,FALSE
Bayesian Inference for Exponential Random Graph Models via Kernel Bayes Rule,http://ww2.amstat.org/meetings/jsm/2019/onlineprogram/AbstractDetails.cfm?abstractid=306465,FALSE
Adaptive Variable Selection for Sequential Prediction in Multivariate Dynamic Models,http://ww2.amstat.org/meetings/jsm/2019/onlineprogram/AbstractDetails.cfm?abstractid=301777,FALSE
Bayesian Quantile Regression Applied to Time Between Healthcare-Associated Infection Events,http://ww2.amstat.org/meetings/jsm/2019/onlineprogram/AbstractDetails.cfm?abstractid=306693,FALSE
A Distributed MCMC Sampler for Latent Dirichlet Allocation,http://ww2.amstat.org/meetings/jsm/2019/onlineprogram/AbstractDetails.cfm?abstractid=306865,FALSE
High Dimensional Posterior Consistency in Mixed Frequency Bayesian Vector Autoregressive Models,http://ww2.amstat.org/meetings/jsm/2019/onlineprogram/AbstractDetails.cfm?abstractid=306884,FALSE
A new Bayesian person-fit analysis method for item response theory models using pivotal discrepancy measures,http://ww2.amstat.org/meetings/jsm/2019/onlineprogram/AbstractDetails.cfm?abstractid=306930,FALSE
Ordinal Probit Functional Regression Models with Application to Computer-Use Behavior in Rhesus Monkeys,http://ww2.amstat.org/meetings/jsm/2019/onlineprogram/AbstractDetails.cfm?abstractid=303062,FALSE
An algorithmic construction of all unbiased estimators of variance components in linear mixed effects models,http://ww2.amstat.org/meetings/jsm/2019/onlineprogram/AbstractDetails.cfm?abstractid=305050,FALSE
Ensemble Learning Integrated with Cancer survivor Intervention Trials,http://ww2.amstat.org/meetings/jsm/2019/onlineprogram/AbstractDetails.cfm?abstractid=306674,FALSE
A Stepped Wedge Design in Practice: Lessons Learned from the DECIDE-LVAD trial,http://ww2.amstat.org/meetings/jsm/2019/onlineprogram/AbstractDetails.cfm?abstractid=306732,FALSE
Construction of the Design Matrix for Generalized Linear Mixed-Effects Models in the Context of Clinical Trials of Treatment Sequences,http://ww2.amstat.org/meetings/jsm/2019/onlineprogram/AbstractDetails.cfm?abstractid=307160,FALSE
 A Bayesian joint model for longitudinal frequency and duration outcomes in a migraine study,http://ww2.amstat.org/meetings/jsm/2019/onlineprogram/AbstractDetails.cfm?abstractid=304102,FALSE
Modeling time?varying effects of multilevel risk factors of hospitalizations in patients on dialysis,http://ww2.amstat.org/meetings/jsm/2019/onlineprogram/AbstractDetails.cfm?abstractid=301739,FALSE
Fast two-stage estimator for clustered count data with overdispersion,http://ww2.amstat.org/meetings/jsm/2019/onlineprogram/AbstractDetails.cfm?abstractid=306453,FALSE
Adaptive sequential design for Seamless phase 2/3 combination,http://ww2.amstat.org/meetings/jsm/2019/onlineprogram/AbstractDetails.cfm?abstractid=302881,FALSE
Selecting critical boundaries in group-sequential trials with multiple endpoints,http://ww2.amstat.org/meetings/jsm/2019/onlineprogram/AbstractDetails.cfm?abstractid=303059,FALSE
Covariate adaptive randomization in seamless phase II/III clinical trials,http://ww2.amstat.org/meetings/jsm/2019/onlineprogram/AbstractDetails.cfm?abstractid=304428,FALSE
Evaluation of Type 1 Error in A 2-in-1 Adaptive Phase 2/3 Design with Dual-Primary Endpoints in Oncology Studies,http://ww2.amstat.org/meetings/jsm/2019/onlineprogram/AbstractDetails.cfm?abstractid=306632,FALSE
Implementation of an adaptive early phase trial design for drug combinations,http://ww2.amstat.org/meetings/jsm/2019/onlineprogram/AbstractDetails.cfm?abstractid=306785,FALSE
Developing Innovative Group Sequential Design Trials that Account for the Correlation between Test Statistics,http://ww2.amstat.org/meetings/jsm/2019/onlineprogram/AbstractDetails.cfm?abstractid=307003,FALSE
Unblinded sample size re-estimation in clinical trials with count outcomes,http://ww2.amstat.org/meetings/jsm/2019/onlineprogram/AbstractDetails.cfm?abstractid=307033,FALSE
On the Robustification of MAP Prior in Bayesian Historical Data Borrowing,http://ww2.amstat.org/meetings/jsm/2019/onlineprogram/AbstractDetails.cfm?abstractid=301737,FALSE
Optimal Two-stage Designs for Exploratory Basket Trials ,http://ww2.amstat.org/meetings/jsm/2019/onlineprogram/AbstractDetails.cfm?abstractid=304363,FALSE
A case study of a complex design for a clinical trial with features of randomized withdrawal and parallel randomization in a rare disease area,http://ww2.amstat.org/meetings/jsm/2019/onlineprogram/AbstractDetails.cfm?abstractid=304737,FALSE
A Bayesian design with conditional borrowing of historical data in a rare disease setting,http://ww2.amstat.org/meetings/jsm/2019/onlineprogram/AbstractDetails.cfm?abstractid=304971,FALSE
Evaluation of False Discovery Rate in Platform Studies,http://ww2.amstat.org/meetings/jsm/2019/onlineprogram/AbstractDetails.cfm?abstractid=306399,FALSE
Platform trial design with incorporating historical data dynamically,http://ww2.amstat.org/meetings/jsm/2019/onlineprogram/AbstractDetails.cfm?abstractid=307336,FALSE
Adjustment of Subgroups Reversal Effect via Bayesian Borrowing Approach in Oncology Regulatory Submission,http://ww2.amstat.org/meetings/jsm/2019/onlineprogram/AbstractDetails.cfm?abstractid=304563,FALSE
Documentation of survey settings in public use data sets,http://ww2.amstat.org/meetings/jsm/2019/onlineprogram/AbstractDetails.cfm?abstractid=302951,FALSE
Balancing privacy and precision: Disclosure control methods in government surveys,http://ww2.amstat.org/meetings/jsm/2019/onlineprogram/AbstractDetails.cfm?abstractid=306493,FALSE
Using Generative Adversarial Networks to generate synthetic population,http://ww2.amstat.org/meetings/jsm/2019/onlineprogram/AbstractDetails.cfm?abstractid=306741,FALSE
Overdispersed binomial small area models with application to poverty rate estimation,http://ww2.amstat.org/meetings/jsm/2019/onlineprogram/AbstractDetails.cfm?abstractid=307231,FALSE
Arrest-Related Deaths Program Redesign Study: Pilot Survey Measures of Decedent and Incident Characteristics,http://ww2.amstat.org/meetings/jsm/2019/onlineprogram/AbstractDetails.cfm?abstractid=306901,FALSE
Likelihood Ratio Test in Multivariate Linear Regression: from Low to High Dimension,http://ww2.amstat.org/meetings/jsm/2019/onlineprogram/AbstractDetails.cfm?abstractid=304649,FALSE
Global and Simultaneous Hypothesis Testing for High-Dimensional Logistic Regression Models,http://ww2.amstat.org/meetings/jsm/2019/onlineprogram/AbstractDetails.cfm?abstractid=304965,FALSE
Inference for high-dimensional linear mixed effects models: A quasi-likelihood approach,http://ww2.amstat.org/meetings/jsm/2019/onlineprogram/AbstractDetails.cfm?abstractid=305239,FALSE
Divergence based inference for High dimensional GLMM,http://ww2.amstat.org/meetings/jsm/2019/onlineprogram/AbstractDetails.cfm?abstractid=306611,FALSE
Fundamental Limits of Exact Support Recovery in High Dimensions,http://ww2.amstat.org/meetings/jsm/2019/onlineprogram/AbstractDetails.cfm?abstractid=306759,FALSE
Debiased Inference in High-dimensional Single-index Models Under Gaussian Design,http://ww2.amstat.org/meetings/jsm/2019/onlineprogram/AbstractDetails.cfm?abstractid=306939,FALSE
